<?xml version="1.0" encoding="UTF-8"?>
<items xmlns="stendhal" xmlns:xsi="http://www.w3.org/2001/XMLSchema-instance"
	xsi:schemaLocation="stendhal ../items.xsd ">

  <item name="note">
    <type class="documents" subclass="paper" tileid="-1"/>
    <description>You see a note.</description>
    <implementation class-name="games.stendhal.server.entity.item.Item"/>    <attributes>
    </attributes>
    <weight value="0.01"/>
    <value value="1"/>
    <equipable>
      <slot name="bag"/>
    </equipable>
  </item>

  <item name="coupon">
    <type class="documents" subclass="coupon" tileid="-1"/>
    <description>You see a coupon.</description>
    <implementation class-name="games.stendhal.server.entity.item.Item"/>    <attributes>
    </attributes>
    <weight value="0.01"/>
    <value value="1"/>
    <equipable>
      <slot name="bag"/>
    </equipable>
  </item>

  <item name="closed envelope">
    <type class="documents" subclass="closed_envelope" tileid="-1"/>
    <description/>
    <implementation class-name="games.stendhal.server.entity.item.Item"/>    <attributes>
    </attributes>
    <weight value="0.01"/>
    <value value="1"/>
    <equipable>
      <slot name="lhand"/>
      <slot name="rhand"/>
      <slot name="bag"/>
    </equipable>
  </item>

  <item name="opened envelope">
    <type class="documents" subclass="opened_envelope" tileid="-1"/>
    <description/>
    <implementation class-name="games.stendhal.server.entity.item.Item"/>    <attributes>
    </attributes>
    <weight value="0.01"/>
    <value value="1"/>
    <equipable>
      <slot name="lhand"/>
      <slot name="rhand"/>
      <slot name="bag"/>
    </equipable>
  </item>

  <item name="sealed envelope">
    <type class="documents" subclass="sealed_envelope" tileid="-1"/>
    <description/>
    <implementation class-name="games.stendhal.server.entity.item.Item"/>    <attributes>
    </attributes>
    <weight value="0.01"/>
    <value value="1"/>
    <equipable>
      <slot name="lhand"/>
      <slot name="rhand"/>
      <slot name="bag"/>
    </equipable>
  </item>

  <item name="unsealed envelope">
    <type class="documents" subclass="unsealed_envelope" tileid="-1"/>
    <description/>
    <implementation class-name="games.stendhal.server.entity.item.Item"/>    <attributes>
    </attributes>
    <weight value="0.01"/>
    <value value="1"/>
    <equipable>
      <slot name="lhand"/>
      <slot name="rhand"/>
      <slot name="bag"/>
    </equipable>
  </item>
  
    <item name="assassins id">
    <type class="documents" subclass="license" tileid="-1"/>
    <description>You see an assassin's ID. Perhaps this can be put to good use.</description>
    <implementation class-name="games.stendhal.server.entity.item.Item"/>    <attributes>
       <quantity value="1"/>
    </attributes>
    <weight value="0.01"/>
    <value value="1"/>
    <equipable>
      <slot name="bag"/>
      <slot name="keyring"/>
    </equipable>
  </item>

  <item name="map">
    <type class="documents" subclass="mapwithgrid" tileid="-1"/>
    <description/>
    <implementation class-name="games.stendhal.server.entity.item.Item"/>    <attributes>
    </attributes>
    <weight value="0.01"/>
    <value value="1"/>
    <equipable>
      <slot name="bag"/>
    </equipable>
  </item>

  <item name="scroll">
    <type class="documents" subclass="scroll" tileid="-1"/>
    <description>You see a rolled up scroll.</description>
    <implementation class-name="games.stendhal.server.entity.item.Item"/>
    <attributes>
       <quantity value="1"/>
    </attributes>
    <weight value="0.01"/>
    <value value="1"/>
    <equipable>
      <slot name="bag"/>
      <slot name="lhand"/>
      <slot name="rhand"/>
    </equipable>
  </item>

  <item name="ice scroll">
    <type class="documents" subclass="ice_scroll" tileid="-1"/>
    <description>You see a scroll, circled by ice crystals. You can feel its cold aura.</description>
    <implementation class-name="games.stendhal.server.entity.item.Item"/>
    <attributes>
       <quantity value="1"/>
    </attributes>
    <weight value="0.01"/>
    <value value="1"/>
    <equipable>
      <slot name="bag"/>
      <slot name="lhand"/>
      <slot name="rhand"/>
    </equipable>
  </item>
</items>