<?xml version="1.0" encoding="UTF-8"?>
<items xmlns="stendhal" xmlns:xsi="http://www.w3.org/2001/XMLSchema-instance"
	xsi:schemaLocation="stendhal ../items.xsd ">

  <item name="arrow_game_token">
    <type class="token" subclass="darkyellow_round_token" tileid="-1"/>
    <description>You see a token, that when placed in the right spot could point you in the right direction.</description>
    <implementation class-name="games.stendhal.server.entity.item.token.Token"/>
    <attributes>
    </attributes>
    <weight value="1.0"/>
    <value value="1"/>
    <equipable>
    </equipable>
  </item>

  <item name="x_board_token">
    <type class="token" subclass="red_x_token" tileid="-1"/>
    <description>You see an X token.</description>
    <implementation class-name="games.stendhal.server.entity.item.token.BoardToken"/>
    <attributes>
    </attributes>
    <weight value="1.0"/>
    <value value="1"/>
    <equipable>
    </equipable>
  </item>

  <item name="o_board_token">
    <type class="token" subclass="blue_o_token" tileid="-1"/>
    <description>You see an O token.</description>
    <implementation class-name="games.stendhal.server.entity.item.token.BoardToken"/>
    <attributes>
    </attributes>
    <weight value="1.0"/>
    <value value="1"/>
    <equipable>
    </equipable>
  </item>
</items>