<?xml version="1.0" encoding="UTF-8"?>
<items xmlns="stendhal" xmlns:xsi="http://www.w3.org/2001/XMLSchema-instance"
	xsi:schemaLocation="stendhal ../items.xsd ">
  
  <item name="crystal of anger">
    <type class="gem" subclass="crystal_red" tileid="-1" />
    <description>You see a #crystal #of #anger.</description>
    <implementation class-name="games.stendhal.server.entity.item.Item" />
    <attributes>
      <quantity value="1" />
      <max_quantity value="2147483647" />
    </attributes>
    <weight value="0.1" />
    <value value="100" />
    <equipable>
      <slot name="ground" />
      <slot name="content" />
      <slot name="lhand" />
      <slot name="rhand" />
      <slot name="head" />
      <slot name="bag" />
    </equipable>
  </item>
  
  <item name="crystal of fear">
    <type class="gem" subclass="crystal_purple" tileid="-1" />
    <description>You see a #crystal #of #fear.</description>
    <implementation class-name="games.stendhal.server.entity.item.Item" />
    <attributes>
      <quantity value="1" />
      <max_quantity value="2147483647" />
    </attributes>
    <weight value="0.1" />
    <value value="100" />
    <equipable>
      <slot name="ground" />
      <slot name="content" />
      <slot name="lhand" />
      <slot name="rhand" />
      <slot name="head" />
      <slot name="bag" />
    </equipable>
  </item>
  
  <item name="crystal of joy">
    <type class="gem" subclass="crystal_yellow" tileid="-1" />
    <description>You see a #crystal #of #joy.</description>
    <implementation class-name="games.stendhal.server.entity.item.Item" />
    <attributes>
      <quantity value="1" />
      <max_quantity value="2147483647" />
    </attributes>
    <weight value="0.1" />
    <value value="100" />
    <equipable>
      <slot name="ground" />
      <slot name="content" />
      <slot name="lhand" />
      <slot name="rhand" />
      <slot name="head" />
      <slot name="bag" />
    </equipable>
  </item>
  
  <item name="crystal of love">
    <type class="gem" subclass="crystal_pink" tileid="-1" />
    <description>You see a #crystal #of #love.</description>
    <implementation class-name="games.stendhal.server.entity.item.Item" />
    <attributes>
      <quantity value="1" />
      <max_quantity value="2147483647" />
    </attributes>
    <weight value="0.1" />
    <value value="100" />
    <equipable>
      <slot name="ground" />
      <slot name="content" />
      <slot name="lhand" />
      <slot name="rhand" />
      <slot name="head" />
      <slot name="bag" />
    </equipable>
  </item>
  
  <item name="crystal of peace">
    <type class="gem" subclass="crystal_blue" tileid="-1" />
    <description>You see a #crystal #of #peace.</description>
    <implementation class-name="games.stendhal.server.entity.item.Item" />
    <attributes>
      <quantity value="1" />
      <max_quantity value="2147483647" />
    </attributes>
    <weight value="0.1" />
    <value value="100" />
    <equipable>
      <slot name="ground" />
      <slot name="content" />
      <slot name="lhand" />
      <slot name="rhand" />
      <slot name="head" />
      <slot name="bag" />
    </equipable>
  </item>
  
</items>