<?xml version="1.0" encoding="UTF-8"?>
<items xmlns="stendhal" xmlns:xsi="http://www.w3.org/2001/XMLSchema-instance"
	xsi:schemaLocation="stendhal ../items.xsd ">
    <item name="snowball">
    <type class="missile" subclass="snowballs" tileid="-1"/>
    <description>You see snowballs. You can throw them on your friends or put it in your bag to keep your fish fresh. But be carfully, there could be little stones in it.</description>
    <implementation class-name="games.stendhal.server.entity.item.NoStatsStackableItem"/>    <attributes>
      <atk value="-1"/>
      <range value="8"/>
      <quantity value="1"/>
    </attributes>
    <weight value="0.1"/>
    <value value="80"/>
    <damage type="ice"/>
    <equipable>
      <slot name="lhand"/>
      <slot name="rhand"/>
      <slot name="bag"/>
    </equipable>
  </item>
  
   <item name="vomit">
    <type class="missile" subclass="vomit" tileid="-1"/>
    <description>You see a pile of vomit. Gross!</description>
    <implementation class-name="games.stendhal.server.entity.item.NoStatsStackableItem"/>    <attributes>
      <atk value="-1"/>
      <range value="5"/>
      <quantity value="1"/>
    </attributes>
    <weight value="0.1"/>
    <value value="2"/>
    <equipable>
      <slot name="lhand"/>
      <slot name="rhand"/>
      <slot name="bag"/>
    </equipable>
  </item>
  
  <item name="dart">
    <type class="missile" subclass="dart" tileid="-1"/>
    <description>You see a dart. You'll need to be close before you can use it as a missile. Stand square on, not diagonally, for the best results.</description>
    <implementation class-name="games.stendhal.server.entity.item.StackableItem"/>    <attributes>
      <atk value="2"/>
      <range value="2"/>
      <quantity value="1"/>
    </attributes>
    <weight value="0.1"/>
    <value value="80"/>
    <equipable>
      <slot name="lhand"/>
      <slot name="rhand"/>
      <slot name="bag"/>
    </equipable>
  </item>

  <item name="power dart">
    <type class="missile" subclass="dart" tileid="-1"/>
    <description>You see a power dart. You'll need to be close before you can use it as a missile. Stand square on, not diagonally, for the best results. </description>
    <implementation class-name="games.stendhal.server.entity.item.StackableItem"/>    <attributes>
      <atk value="4"/>
      <range value="2"/>
      <quantity value="1"/>
    </attributes>
    <weight value="0.1"/>
    <value value="640"/>
    <equipable>
      <slot name="lhand"/>
      <slot name="rhand"/>
      <slot name="bag"/>
    </equipable>
  </item>

  <item name="shuriken">
    <type class="missile" subclass="shuriken" tileid="-1"/>
    <description>You see a shuriken. You'll need to be close before you can use it as a missile. Stand square on, not diagonally, for the best results.</description>
    <implementation class-name="games.stendhal.server.entity.item.StackableItem"/>    <attributes>
      <atk value="6"/>
      <range value="2"/>
      <quantity value="1"/>
    </attributes>
    <weight value="0.1"/>
    <value value="2160"/>
    <equipable>
      <slot name="lhand"/>
      <slot name="rhand"/>
      <slot name="bag"/>
    </equipable>
  </item>

  <item name="wooden spear">
    <type class="missile" subclass="wooden_spear" tileid="-1"/>
    <description>You see a wooden spear. You can attack at a distance with this primitive weapon. Stand square on, not diagonally, for the best results.</description>
    <implementation class-name="games.stendhal.server.entity.item.StackableItem"/>    <attributes>
      <atk value="10"/>
      <range value="4"/>
      <quantity value="1"/>
    </attributes>
    <weight value="0.1"/>
    <value value="10000"/>
    <equipable>
      <slot name="lhand"/>
      <slot name="rhand"/>
      <slot name="bag"/>
    </equipable>
  </item>
</items>
